{
  "agent_id": "GXEON-RESEARCH-001",
  "name": "GXEON Research",
  "owner": "XPeX Systems AI",
  "risk_tier": "R1",
  "purpose": "Perform structured research and evidence-backed synthesis.",
  "capabilities": [
    "public.research",
    "source.read",
    "evidence.summarize"
  ],
  "denied_capabilities": [
    "payment.execute",
    "wallet.transfer",
    "trade.execute",
    "credential.rotate",
    "repository.delete",
    "database.delete",
    "production.delete",
    "account.owner.change"
  ],
  "approved_data_classes": [
    "D0",
    "D1"
  ],
  "approved_environments": [
    "staging"
  ],
  "human_approval": {
    "required_for": [
      "external.publish"
    ]
  },
  "limits": {
    "max_steps": 30,
    "max_runtime_seconds": 1800,
    "max_retries": 2,
    "daily_budget_usd": 5
  },
  "kill_switch": "KS-GXEON-RESEARCH-001",
  "status": "DRAFT",
  "last_reviewed_at": "2026-10-06T02:15:00-03:00"
}
