{
  "agent_id": "GXEON-REVENUE-001",
  "name": "GXEON Revenue",
  "owner": "XPeX Systems AI",
  "risk_tier": "R2",
  "purpose": "Support approved commercial operations and revenue workflows.",
  "capabilities": [
    "pipeline.read",
    "proposal.draft",
    "pricing.read"
  ],
  "denied_capabilities": [
    "payment.execute",
    "wallet.transfer",
    "trade.execute",
    "credential.rotate",
    "repository.delete",
    "database.delete",
    "production.delete",
    "account.owner.change"
  ],
  "approved_data_classes": [
    "D0",
    "D1",
    "D2"
  ],
  "approved_environments": [
    "staging"
  ],
  "human_approval": {
    "required_for": [
      "contract.commit",
      "payment.execute",
      "external.send"
    ]
  },
  "limits": {
    "max_steps": 20,
    "max_runtime_seconds": 1800,
    "max_retries": 2,
    "daily_budget_usd": 10
  },
  "kill_switch": "KS-GXEON-REVENUE-001",
  "status": "DRAFT",
  "last_reviewed_at": "2026-10-06T02:15:00-03:00"
}
