{
  "agent_id": "GXEON-ENGINEER-001",
  "name": "GXEON Engineer",
  "owner": "XPeX Systems AI",
  "risk_tier": "R2",
  "purpose": "Implement bounded engineering changes in approved repositories and environments.",
  "capabilities": [
    "code.change_scoped",
    "test.run",
    "branch.create",
    "pull_request.create"
  ],
  "denied_capabilities": [
    "payment.execute",
    "wallet.transfer",
    "trade.execute",
    "credential.rotate",
    "repository.delete",
    "database.delete",
    "production.delete",
    "account.owner.change"
  ],
  "approved_data_classes": [
    "D0",
    "D1",
    "D2"
  ],
  "approved_environments": [
    "staging"
  ],
  "human_approval": {
    "required_for": [
      "production.promote",
      "critical.merge",
      "secret.change",
      "destructive.action"
    ]
  },
  "limits": {
    "max_steps": 20,
    "max_runtime_seconds": 1800,
    "max_retries": 2,
    "daily_budget_usd": 5
  },
  "kill_switch": "KS-GXEON-ENGINEER-001",
  "status": "DRAFT",
  "last_reviewed_at": "2026-10-06T02:15:00-03:00"
}
